"id","title","year","language","authors"
"hvd.32044012135182","Guerras pir?ticas de Filipinas contra mindanaos y joloanos : corr. ? ilustradas por don Vicente Barrantes.","1878","spa","Barrantes, Vicente 1829-1898"
"uc1.$b196871","Los misioneros en Filipinas, sus relaciones con la civilizacio?n y dominacio?n espan?ola.","1895","spa",""
"uc1.$b52617","Arti?culos varios sobre etnografi?a, historia y costumbres de Filipinas. Con un pro?logo cri?tico de D. Cesareo Blanco y Sierra ...","1888","spa",""
"miun.acg8363.0001.001","Los frailes de Filipinas : breves consideraciones de actualidad escritas por un Espa?ol peninsular / Baltasar Giraudier.","1888","spa","Giraudier, Baltasar"
"yale.39002044556935","Historia general de Filipinas desde el descubrimiento de dichas islas hasta nuestras d?as, por D. Jos? Montero y Vidal ...","1895","spa","Montero y Vidal, Jos?"
"hvd.hnnh75","Apuntes geogr?ficos de las islas Filipinas, escritos sobre el terreno, por Enrique Mhartin y Guix ...","1889","spa",""
"hvd.32044009842055","Colonizaci?n de Filipinas : estudios pr?cticos acerca de la colonizaci?n con elementos peninsulares, de nuestras posesiones oce?nicas / rese?a geogrf?ico-geol?gico-minera de las mismas por J. N. Aguilar, con un pr?logo de D. Ar?stides Saenz de Urraca.","1893","spa","Nieto Aguila, Jos?; Saenz de Urraca, Aristides"
"coo.31924023985512","El filibustero (novela corta filipina) / con un ape?ndice por W.E. Retana.","1893","spa","Ferna?ndez Lo?pez, Ventura"
"hvd.hnnh5p","Filipinas.","1880","spa","Vila, Francisco"
"hvd.32044106342280","Memoria descriptiva de la provincia de Manila.","1880","spa","Ugaldezubiaur, Santiago"
"hvd.hnsvcq","Los frailes en Filipinas.","1872","spa","Lallave, Manrique Alonso"
"miun.aaw3613.0001.001","Viajes por Filipinas de Manila a Marianas/ Juan Alvarez Guerra.","1887","spa","Alvarez Guerra, Juan 1770-1845"
"hvd.32044004449427","Paralelo entre la conquista y dominaci?n de Am?rica y el descubrimiento y pacificaci?n de Filipinas, por el padre fr. Evaristo Fern?ndez Arias. Memoria laureada ...","1893","spa","Fern?ndez Arias, Evaristo 1854-1908"
"uc1.31822038212049","Derrotero de la navegacion a? las islas Filipinas : con los viages de ida y vuelta a? aquellas islas en ambas mozones, y la descripcion de las islas de Sonda, Molucas ... / por ... Antonio Maestre y Can?amares","1862","spa",""
"miun.ajt5952.0001.001","[Documentos in?ditos] de las islas Filipinas.","1887","spa","Salas y Rodriguez, Francisco Javier de d. 1890"
"hvd.hnqxlg","Filipinas; cosas de all? (p?ginas literarias) por W. E. Retana.","1893","spa","Retana, W. E. (Wenceslao Emilio) 1862-1924"
"njp.32101073012880","Filipinas; reorganizacio?n de su eje?rcito, gobiernos y comandancias poli?tico-militares; colonias penitenciarias-militares y colonias militares indi?genas ...","1895","spa",""
"hvd.32044009837519","Memoria sobre la poblacion y riqueza de las islas Filipinas, y reformas econ?mico-administrativas que el gobierno espa?ol debe plantear para la prosperidad de aquellas posesiones y del estado ... por D. Casimiro de Grau y Figueras ...","1855","spa",""
"uc1.$b52620","Las costumbres en los Tagalos en Filipinas / segu?n el Padre Plasencia ; por T. H. Pardo de Tavera.","1892","spa",""
"hvd.hnw1jw","Diario del viage desde Madrid a Manila, en las islas Filipinas, por la via del itsmo [!] de Suez, que de ?rden del gobierno de S. M. hizo en principios de 1844 el coronel Don Eusebio de Santos. Modificado y ampliado posteriormente ? consecuencia del que en parte verific? ? su regreso de las indicadas posesiones por la misma via.","1851","spa","Santos, Eusebio de"
"hvd.32044079711396","La instruccion primaria en Filipinas, por V. Barrantes ...","1869","spa","Barrantes, Vicente 1829-1898"
"miun.acu8855.0001.001","Memoria acerca de las Misiones de los PP. Agustinos Calzados en las Islas Filipinas : presentada al Excmo. Sr. Ministro de Ultramar / por el R. P. Comisario de la misma orden.","1892","spa","Font, Salvador 1844-1908"
"uc1.$b264799","Recuerdos de Filipinas. Cosas, casos y usos de aquellas islas: vistos, oidos, tocados y contados por Francisco Ca?amaque. Con una carta-pr?logo del Excmo. Sr. D. Patricio de la Escosura ...","1877","spa","Ca?amaque y Jiminez, Francisco 1851-1891"
"mdp.39015001022717","Poblacion y comercio de Filipinas / por J. Jimeno Agius.","1884","spa","Jimeno Agius, Jos? 1835-1901"
"uc1.b4952037","Exploraci?n del territorio de Davao (Filipinas) / practicada por Joaqu?n Rajal y Larr?.","1891","spa","Sociedad Geogr?fica de Madrid"
"ucm.4900297006","Espa?a en la Occean?a : Estudios hist?ricos sobre Filipinas, proyecto de conquista y colonizaci?n de Mindanao.","1862","spa","Garc?a del Canto, A"
"mdp.39015019196321","Historia de la exposici?n de las islas Filipinas en Madrid el a?o de 1887, con una explicaci?n de su posici?n geogr?fica, de c?mo las hemos adquirido, y un compendio de la historia de las Marianas, Carolinas, Filipinas y Palaos, su producci?n, importaci?n y exportaci?n ...","1887","spa","Taviel de Andrade, Enrique"
"mdp.39015058854327","Filipinas : notas de viaje y de estancia / por Jos? Fern?ndez Giner ; con un pr?logo de Luis de Rute.","1889","spa","Fern?ndez Giner, Jos? b. 1850; Rute, Louis de"
"uc1.$b592315","Siluetas y matices, Galeria filipina. Con un pr?logo de Javier G?mez de la Serna.","1894","spa",""
"hvd.hnnh7g","Apuntes interesantes sobre las Islas Filipinas : que pueden ser ?tiles para hacer las reformes convenientes y productivas para el pa?s y para la naci?n / escritos por un espa?ol de larga esperiencia en el pa?s y amante del progreso.","1869","spa","Barrantes, Vicente 1829-1898; Herrero, Casimiro 1824-1886"
"hvd.hnnh7h","Las colonias espa?olas de Asia. Islas Filipinas, por el teniente coronel comandante de infanteria Manuel Scheidnagel.","1880","spa","Scheidnagel, Manuel -1898"
"hvd.32044009835216","De Manila ? Albay, por Don Juan ?lvarez Guerra.","1887","spa","Alvarez Guerra, Juan 1843-1905"
"hvd.hnnh7a","Escenas filipinas. Narraciones originales de costumbres de dichas islas por Francisco Vila ... precedidas de un pr?logo de D. Rafael Ginard de la Rosa ...","1882","spa","Vila, Francisco"
"hvd.32044080208846","Pacita, ?, La virtuosa Filipina [microform] : novela recreativa de costumbres orientales / escrita por Antonia Rodrigues de Ureta.","1892","spa",""
"yale.39002002407063","Cuba, Puerto-Rico y Filipinas; por d. Waldo Jime?nez de la Romera.","1887","spa",""
"hvd.32044082382219","El general Despujol en Filipinas.","1892","spa",""
"chi.20507766","Las islas Filipinas (de todo un poco) ...","1880","spa",""
"njp.32101073012898","Estadismo de las islas Filipinas : ?, Mis viajes por este pa?s / por el padre fr. Joaqu?n Mart?nez de Z??iga, Agustino calzado. Publica esta obra por primera vez extensamente anotada W. E. Retana.","1893","spa","Retana, W. E. (Wenceslao Emilio) 1862-1924"
"ucm.532528894x","Rese?a historica de la guerra al sur de Filipinas, sostenida por las armas espa?olas contra los piratas de aquel archipielago : desde la conquista hasta nuestros dias / por Emilio Bern?ldez ...","1857","spa","Bern?ldez, Emilio; Guerra, Francisco 1916- ant. pos; Imprenta del Memorial de Ingenieros (Madrid)"
"hvd.32044082382011","Los frailes en Filipinas : t?sis : en qui?nes debe apoyarse el gobierno de Filipinas? / por Francisco Piferrer.","1879","spa","Piferrer, Francisco 1813-1863"
"mdp.39015022912581","El progreso de filipinas : estudios econ?micos, administrativos y pol?ticos / por Gregorio Sancianco y Goson.","1881","spa","Sancianco y Goson, Gregorio d. 1892"
"mdp.39015047631380","Las islas Filipinas en 1882; estudios hist?ricos, geogr?ficos, estad?sticos y descriptivos,","1883","spa","Moya y Jimenez, Francisco Javier de"
"uc1.a0001016690","Manifiesto al pais sobre los sucesos de Cavite y memoria sobre la administracion y gobierno de las Islas Filipinas / por D. Ca?rlos Mari?a de la Torre.","1872","spa","Torre, Ca?rlos Mari?a de la"
"uc1.b4225850","Exposici?n General de las Islas Filipinas, 1887.","1886","spa","Exposici?n General de las Islas Filipinas (1887 : Madrid, Spain)"
"uc1.$b587317","La immigraci?n China en Filipinas, por D. Ram?n Jordana y Morera.","1888","spa",""
"hvd.hnnh6b","Memoria sobre Filipinas y Jol?, redactada en 1863 y 1864. Precedida de un pr?logo de Francisco Ca?amaque.","1883","spa","Escosura, Patricio de la 1807-1878"
"mdp.39015062929438","Siluetas filipinas, por Ximeno Xim?nez.","1887","spa","D?az de la Quintana, Alberto d. 1911"
"miun.apz3215.0001.001","Apuntes intreseantes sobre las islas Filipinas que pueden ser utiles para hacer las reformas convenientes y productivas para el pais y para la nacion / Vicente Barrantes y Moreno.","1869","spa","Barrantes, Vicente 1829-1898; American Philosophical Society Library"
"mdp.39015026720832","Relato de un viaje de Espa?a ? Filipinas, por M. Walls y Merino.","1895","spa","Walls y Merino, Manuel"
"hvd.32044082382169","Rese?a que demuestra el fundamento y causas de la insurrecci?n del 20 de enero en Filipinas, con los medios de evitarla en lo sucesivo.","1872","spa",""
"dul1.ark:/13960/t3gx5277h","Filipinas. Distrito de Benguet. Memoria descriptiva y econ?mica, acompa?ada del primer plan-cr?quis del mismo, por Manuel Scheidnagel ...","1878","spa","Scheidnagel, Manuel d. 1898"
"uc1.c051358909","Consideraciones acerca de la actual situaci?n pol?tica de Filipinas, por el profesor Fernando Blumentritt.","1889","spa","Blumentritt, Ferdinand 1853-1913"
"miun.afj2145.0001.001","Avisos y profec?as / por W. E. Retana.","1892","spa","Retana, W. E. (Wenceslao Emilio) 1862-1924"
"mdp.39015035097008","Islas Filipinas (memoria).","1895","spa","Balaguer, Victor 1824-1901"
"hvd.32044083861278","","","",""
"hvd.hnnh5q","","","",""
